<!DOCTYPE dataset SYSTEM "src/test/resources/dataset.dtd">
<dataset>

    <computer id="1"
              name="Computer1"
              introduced="2010-10-10"
              discontinued="2010-10-12"
              company_id="1"/>
    <computer id="3"
              name="Computer3"
              introduced="1989-12-05"
              discontinued="2010-10-12" />
    <computer id="15"
              name="Computer15"
              introduced="1999-09-06"
              company_id="5"/>
    <computer id="18"
              name="Computer18"
              company_id="1"/>
    <computer id="22"
              name="Computer22Improved"
              introduced="1989-05-09"
              discontinued="2019-01-02"
              company_id="1"/>
    <computer id="42"
              name="Computer42"
              discontinued="2000-03-03"
              company_id="2"/>
    <computer id="44" name="Computer44"
              introduced="1970-01-01"
              discontinued="2070-01-01"
              company_id="4"/>
    <computer id="69"
              name="Macintosh"  />
    <computer id="666"
              name="Evil"
              introduced="2000-11-12"
              company_id="9" />
    <computer id="999"
              name="Computer999"
              introduced="1980-11-11"
              discontinued="2099-01-01"
              company_id="5"/>

</dataset>
